{
    "schemaVersion":  1,
    "sdkApiVersion":  "1.4",
    "minimumHostVersion":  "1.8.0-beta.1",
    "modules":  [
                    {
                        "id":  "starpie.plugin.cadcommand",
                        "name":  "CAD 模拟按键与命令输入",
                        "project":  "src/StarPie.Plugin.CadCommand/StarPie.Plugin.CadCommand.csproj",
                        "assembly":  "StarPie.Plugin.CadCommand.dll",
                        "targetFramework":  "net8.0-windows",
                        "version":  "1.0.2",
                        "pluginId":  "starpie.plugin.cadcommand",
                        "contributionId":  "cadCommand",
                        "entryType":  "StarPie.Plugin.CadCommand.CadCommandPlugin",
                        "typeClaims":  [
                                       ],
                        "capabilities":  [
                                             "InputSimulation"
                                         ],
                        "releaseDirectory":  "StarPie.Plugin.CadCommand",
                        "description":  "StarPie 官方插件：专为 CAD 设计师优化的文本与模拟按键输入工具。可在「插件」页单独停用。",
                        "author":  "StarPie Studio",
                        "license":  "MIT",
                        "homepage":  "https://github.com/Star-Pie/StarPie",
                        "icon":  null,
                        "tags":  [
                                     "official",
                                     "plugin"
                                 ],
                        "enabled":  true,
                        "apiVersion":  "1.4",
                        "minHostVersion":  "1.8.0-beta.1"
                    },
                    {
                        "id":  "starpie.plugin.keypadlayer",
                        "name":  "按键映射",
                        "project":  "src/StarPie.Plugin.KeypadLayer/StarPie.Plugin.KeypadLayer.csproj",
                        "assembly":  "StarPie.Plugin.KeypadLayer.dll",
                        "targetFramework":  "net8.0-windows",
                        "version":  "1.0.1",
                        "pluginId":  "starpie.plugin.keypadlayer",
                        "contributionId":  "keypadLayer",
                        "entryType":  "StarPie.Plugin.KeypadLayer.KeypadLayerPlugin",
                        "typeClaims":  [
                                       ],
                        "capabilities":  [
                                             "InputRemapping"
                                         ],
                        "releaseDirectory":  "StarPie.Plugin.KeypadLayer",
                        "description":  "通过轮盘开启或关闭自定义按键映射，将物理按键映射为目标按键；支持可视化配置，并在切换应用或长按 Esc 时安全释放。默认提供左手数字小键盘预设。",
                        "author":  "StarPie Studio",
                        "license":  "MIT",
                        "homepage":  "https://github.com/Star-Pie/StarPie",
                        "icon":  null,
                        "tags":  [
                                     "official",
                                     "plugin"
                                 ],
                        "enabled":  true,
                        "apiVersion":  "1.7",
                        "minHostVersion":  "1.8.0-beta.3"
                    },
                    {
                        "id":  "starpie.builtin.command",
                        "name":  "运行命令",
                        "project":  "src/StarPie.Plugin.Command/StarPie.Plugin.Command.csproj",
                        "assembly":  "StarPie.Plugin.Command.dll",
                        "targetFramework":  "net8.0-windows",
                        "version":  "1.0.0",
                        "pluginId":  "starpie.builtin.command",
                        "contributionId":  "command",
                        "entryType":  "StarPie.Plugin.Command.CommandPlugin",
                        "typeClaims":  [
                                           "Command"
                                       ],
                        "capabilities":  [
                                             "Process"
                                         ],
                        "releaseDirectory":  "StarPie.Plugin.Command",
                        "description":  "随 StarPie 分发的内置动作：在指定终端中执行命令行。可在「插件」页单独停用。",
                        "author":  "StarPie Studio",
                        "license":  "MIT",
                        "homepage":  "https://github.com/SoftBlack42/StarPie",
                        "icon":  null,
                        "tags":  [
                                     "official",
                                     "builtin"
                                 ],
                        "enabled":  true
                    },
                    {
                        "id":  "starpie.builtin.folder",
                        "name":  "打开文件夹",
                        "project":  "src/StarPie.Plugin.Folder/StarPie.Plugin.Folder.csproj",
                        "assembly":  "StarPie.Plugin.Folder.dll",
                        "targetFramework":  "net8.0-windows",
                        "version":  "1.0.0",
                        "pluginId":  "starpie.builtin.folder",
                        "contributionId":  "folder",
                        "entryType":  "StarPie.Plugin.Folder.FolderPlugin",
                        "typeClaims":  [
                                           "Folder",
                                           "OpenFolder"
                                       ],
                        "capabilities":  [
                                             "Process"
                                         ],
                        "releaseDirectory":  "StarPie.Plugin.Folder",
                        "description":  "随 StarPie 分发的内置动作：打开文件夹或定位到文件。可在「插件」页单独停用。",
                        "author":  "StarPie Studio",
                        "license":  "MIT",
                        "homepage":  "https://github.com/SoftBlack42/StarPie",
                        "icon":  null,
                        "tags":  [
                                     "official",
                                     "builtin"
                                 ],
                        "enabled":  true
                    },
                    {
                        "id":  "starpie.builtin.launch",
                        "name":  "启动程序",
                        "project":  "src/StarPie.Plugin.Launch/StarPie.Plugin.Launch.csproj",
                        "assembly":  "StarPie.Plugin.Launch.dll",
                        "targetFramework":  "net8.0-windows",
                        "version":  "1.0.0",
                        "pluginId":  "starpie.builtin.launch",
                        "contributionId":  "launch",
                        "entryType":  "StarPie.Plugin.Launch.LaunchPlugin",
                        "typeClaims":  [
                                           "Launch"
                                       ],
                        "capabilities":  [
                                             "Process"
                                         ],
                        "releaseDirectory":  "StarPie.Plugin.Launch",
                        "description":  "随 StarPie 分发的内置动作：启动程序或应用。可在「插件」页单独停用。",
                        "author":  "StarPie Studio",
                        "license":  "MIT",
                        "homepage":  "https://github.com/SoftBlack42/StarPie",
                        "icon":  null,
                        "tags":  [
                                     "official",
                                     "builtin"
                                 ],
                        "enabled":  true
                    },
                    {
                        "id":  "starpie.builtin.movemonitor",
                        "name":  "窗口移到下一屏",
                        "project":  "src/StarPie.Plugin.MoveMonitor/StarPie.Plugin.MoveMonitor.csproj",
                        "assembly":  "StarPie.Plugin.MoveMonitor.dll",
                        "targetFramework":  "net8.0-windows",
                        "version":  "1.0.0",
                        "pluginId":  "starpie.builtin.movemonitor",
                        "contributionId":  "moveMonitor",
                        "entryType":  "StarPie.Plugin.MoveMonitor.MoveMonitorPlugin",
                        "typeClaims":  [
                                           "MoveMonitor"
                                       ],
                        "capabilities":  [
                                             "WindowControl"
                                         ],
                        "releaseDirectory":  "StarPie.Plugin.MoveMonitor",
                        "description":  "随 StarPie 分发的内置动作：窗口移到下一屏。可在「插件」页单独停用。",
                        "author":  "StarPie Studio",
                        "license":  "MIT",
                        "homepage":  "https://github.com/SoftBlack42/StarPie",
                        "icon":  null,
                        "tags":  [
                                     "official",
                                     "builtin"
                                 ],
                        "enabled":  true
                    },
                    {
                        "id":  "starpie.builtin.ocr",
                        "name":  "截屏识字 (OCR)",
                        "project":  "src/StarPie.Plugin.Ocr/StarPie.Plugin.Ocr.csproj",
                        "assembly":  "StarPie.Plugin.Ocr.dll",
                        "targetFramework":  "net8.0-windows",
                        "version":  "1.0.0",
                        "pluginId":  "starpie.builtin.ocr",
                        "contributionId":  "ocr",
                        "entryType":  "StarPie.Plugin.Ocr.OcrPlugin",
                        "typeClaims":  [
                                           "Ocr",
                                           "ScreenOcr"
                                       ],